{
  "externalId": "CURR-IND20-L01-Q06",
  "type": "MULTIPLE_CHOICE_MULTIPLE_ANSWER",
  "chapterCode": "CH-DP",
  "subchapterCode": "SC-DATA",
  "competencyCode": "IND-020",
  "levelCode": null,
  "difficulty": null,
  "stem": {
    "text": "Seorang guru ingin mengetahui kebiasaan siswa menggunakan internet untuk belajar. Pilihlah semua pertanyaan yang sesuai dengan tujuan tersebut!",
    "assetKeys": []
  },
  "options": [
    {
      "id": "A",
      "content": {
        "text": "Berapa lama kamu menggunakan internet untuk belajar setiap hari?",
        "assetKeys": []
      }
    },
    {
      "id": "B",
      "content": {
        "text": "Apakah kamu menggunakan internet untuk belajar?",
        "assetKeys": []
      }
    },
    {
      "id": "C",
      "content": {
        "text": "Siapa penemu internet?",
        "assetKeys": []
      }
    },
    {
      "id": "D",
      "content": {
        "text": "Aplikasi apa yang sering kamu gunakan untuk belajar?",
        "assetKeys": []
      }
    }
  ],
  "answer": {
    "optionIds": ["A", "B", "D"]
  },
  "explanation": {
    "text": "Pernyataan 1, 2, dan 4 secara langsung menghasilkan data mengenai kebiasaan penggunaan internet untuk belajar. Pernyataan 3 tidak berkaitan dengan kebiasaan siswa.",
    "assetKeys": []
  },
  "metadata": {
    "source": "CURRICULUM_SHEETS_SAMPLE",
    "sourceSpreadsheetId": "1zU6OeahFcDWhF6Eq5HNy2LsSFi5yPVahr7QnZbKn0nw",
    "sourceUrl": "https://docs.google.com/document/d/1xqdU-DLVW3dlscxKOCb1H1MNPqIPgQFtgpGc-1Jbexg/edit?usp=sharing",
    "sourceLocation": "Indikator 20 - 23_Abim / Indikator 20 / Level 1 / Soal 6",
    "batchId": "SAMPLE-2026-10-03",
    "indicatorSource": "20 - Perumusan pertanyaan untuk mendapatkan data, serta penyajian, dan peginterpretasian data",
    "chapterSource": "Data & Peluang",
    "subchapterSource": "Data",
    "sourceLevelNumber": 1,
    "sourceQuestionNumber": 6,
    "cognitiveLevel": "C3",
    "variantKind": "ORIGINAL",
    "contentStatus": "DRAFT",
    "sourceReviewStatus": "BELUM_DIREVIEW",
    "sourceExtractionNotes": "Pernyataan sumber 1–4 dipetakan ke itemId A–D sesuai urutan. Kunci sumber 1, 2, 4 → A, B, D. Rubrik skor dan dukungan UI/engine belum ditetapkan. Pemetaan master dan difficulty menunggu.",
    "difficultyReview": "BELUM_DISETUJUI",
    "pendingFields": [],
    "importReady": false,
    "assetManifest": [],
    "mediaMarkerConvention": null,
    "scoringRubricStatus": "PARTIAL_DETAILS_PENDING_CURRICULUM",
    "masterMappingStatus": "PROPOSED_FOR_SAMPLE_REVIEW",
    "levelMappingMethod": "SUBCHAPTER_AND_SOURCE_LEVEL_NUMBER",
    "difficultyClassification": "BANK_USES_CURRICULUM_LEVEL_PVP_MAPPING_OPEN",
    "sourceNamespace": "CURRICULUM_SHEETS_SAMPLE",
    "importBlockers": [
      "MASTER_DATA_NOT_SEEDED",
      "DIFFICULTY_NULL_CONTRACT_PENDING",
      "IMPORT_RUNTIME_PENDING",
      "CURRICULUM_REVIEW_PENDING"
    ],
    "rendererStatus": "NOT_IMPLEMENTED",
    "processingNotes": [
      "Codes mapped to proposed sample master table on 2026-10-03; database not seeded.",
      "Level follows Curriculum. difficulty and optional levelCode intentionally remain null.",
      "Source review status and extraction notes preserved; they are not current upload receipts."
    ]
  }
}
