{
  "externalId": "CURR-IND20-L01-Q05",
  "type": "SINGLE_CHOICE",
  "chapterCode": "CH-DP",
  "subchapterCode": "SC-DATA",
  "competencyCode": "IND-020",
  "levelCode": null,
  "difficulty": null,
  "stem": {
    "text": "Perhatikan data jumlah saudara kandung siswa berikut.\n1, 2, 2, 3, 1, 2, 4, 3, 2, 1\nModus dari data tersebut adalah ....",
    "assetKeys": []
  },
  "options": [
    {
      "id": "A",
      "content": {
        "text": "2",
        "assetKeys": []
      }
    },
    {
      "id": "B",
      "content": {
        "text": "3",
        "assetKeys": []
      }
    },
    {
      "id": "C",
      "content": {
        "text": "4",
        "assetKeys": []
      }
    },
    {
      "id": "D",
      "content": {
        "text": "1",
        "assetKeys": []
      }
    }
  ],
  "answer": {
    "optionId": "A"
  },
  "explanation": {
    "text": "Modus adalah nilai yang paling sering muncul. Angka 2 muncul sebanyak empat kali, sehingga modusnya adalah 2.",
    "assetKeys": []
  },
  "metadata": {
    "source": "CURRICULUM_SHEETS_SAMPLE",
    "sourceSpreadsheetId": "1zU6OeahFcDWhF6Eq5HNy2LsSFi5yPVahr7QnZbKn0nw",
    "sourceUrl": "https://docs.google.com/document/d/1xqdU-DLVW3dlscxKOCb1H1MNPqIPgQFtgpGc-1Jbexg/edit?usp=sharing",
    "sourceLocation": "Indikator 20 - 23_Abim / Indikator 20 / Level 1 / Soal 5",
    "batchId": "SAMPLE-2026-10-03",
    "indicatorSource": "20 - Perumusan pertanyaan untuk mendapatkan data, serta penyajian, dan peginterpretasian data",
    "chapterSource": "Data & Peluang",
    "subchapterSource": "Data",
    "sourceLevelNumber": 1,
    "sourceQuestionNumber": 5,
    "cognitiveLevel": "C3",
    "variantKind": "ORIGINAL",
    "contentStatus": "DRAFT",
    "sourceReviewStatus": "BELUM_DIREVIEW",
    "sourceExtractionNotes": "Sampel ekstraksi; kunci disalin dari sumber, belum disetujui reviewer. Kode master, level database, dan difficulty belum dipetakan.",
    "difficultyReview": "BELUM_DISETUJUI",
    "pendingFields": [],
    "importReady": false,
    "assetManifest": [],
    "mediaMarkerConvention": null,
    "scoringRubricStatus": "NOT_SPECIFIED_IN_THIS_CONTENT_FILE",
    "masterMappingStatus": "PROPOSED_FOR_SAMPLE_REVIEW",
    "levelMappingMethod": "SUBCHAPTER_AND_SOURCE_LEVEL_NUMBER",
    "difficultyClassification": "BANK_USES_CURRICULUM_LEVEL_PVP_MAPPING_OPEN",
    "sourceNamespace": "CURRICULUM_SHEETS_SAMPLE",
    "importBlockers": [
      "MASTER_DATA_NOT_SEEDED",
      "DIFFICULTY_NULL_CONTRACT_PENDING",
      "IMPORT_RUNTIME_PENDING",
      "CURRICULUM_REVIEW_PENDING"
    ],
    "rendererStatus": "NOT_IMPLEMENTED",
    "processingNotes": [
      "Codes mapped to proposed sample master table on 2026-10-03; database not seeded.",
      "Level follows Curriculum. difficulty and optional levelCode intentionally remain null.",
      "Source review status and extraction notes preserved; they are not current upload receipts."
    ]
  }
}
